{
  "kind": "neutrino.participant-view",
  "schemaVersion": "0.2.0",
  "procedure": "core_secured_offer",
  "dslVersion": "1.0.0",
  "capability": { "capabilityHash": "f3f9120b9c970ec8b4342f6e368966ba54bd1e56470a946952fe83a0be0c1565", "specVersion": "1.0.0" },
  "participant": { "name": "Sponsor", "role": "sponsor", "org": "sponsorco", "slotId": "coordinate.core_secured_offer#Sponsor" },
  "visibleOperations": ["OPEN", "NEGOTIATE", "PROPOSE", "COMMIT", "REJECT", "COMPENSATE", "CLOSE"],
  "requiredInputs": [
    { "name": "offer_id", "type": "string", "specPath": "inputs[0]", "source": { "line": 30, "column": 1 } },
    { "name": "sponsor_id", "type": "party", "specPath": "inputs[1]", "source": { "line": 31, "column": 1 } },
    { "name": "contribution", "type": "money", "specPath": "inputs[3]", "source": { "line": 33, "column": 1 } },
    { "name": "currency", "type": "currency", "specPath": "inputs[4]", "source": { "line": 34, "column": 1 } }
  ],
  "permittedCounterparties": [
    { "org": "acme" }
  ],
  "evidenceObligations": [
    { "leg": "sponsor_commitment", "kind": "debit", "ledger": "sponsor.commitment", "specPath": "effects[0]", "source": { "line": 36, "column": 1 } }
  ],
  "provenance": { "derivedFrom": "capability-spec.json", "specContract": { "kind": "neutrino.capability-spec", "schemaVersion": 1 } }
}
