{
  "kind": "neutrino.participant-view",
  "schemaVersion": "0.2.0",
  "procedure": "core_flexible_binding",
  "dslVersion": "1.0.0",
  "capability": {
    "capabilityHash": "300394cd718cde7cf1c6d950413d5128aa860d4b32374542d42b8e64525bf4ff",
    "specVersion": "1.0.0"
  },
  "participant": {
    "name": "Merchant",
    "role": "merchant",
    "org": "acme",
    "slotId": "coordinate.core_flexible_binding#Merchant"
  },
  "visibleOperations": [
    "OPEN",
    "NEGOTIATE",
    "PROPOSE",
    "COMMIT",
    "REJECT",
    "COMPENSATE",
    "CLOSE"
  ],
  "requiredInputs": [
    {
      "name": "offer_id",
      "type": "string",
      "specPath": "inputs[0]",
      "source": {
        "line": 40,
        "column": 1
      }
    },
    {
      "name": "merchant_id",
      "type": "party",
      "specPath": "inputs[2]",
      "source": {
        "line": 42,
        "column": 1
      }
    },
    {
      "name": "contribution",
      "type": "money",
      "specPath": "inputs[3]",
      "source": {
        "line": 43,
        "column": 1
      }
    },
    {
      "name": "currency",
      "type": "currency",
      "specPath": "inputs[4]",
      "source": {
        "line": 44,
        "column": 1
      }
    }
  ],
  "permittedCounterparties": [
    {
      "org": "sponsorco",
      "role": "sponsor"
    }
  ],
  "evidenceObligations": [
    {
      "leg": "merchant_expected_contribution",
      "kind": "credit",
      "ledger": "merchant.expected_contribution",
      "specPath": "effects[1]",
      "source": {
        "line": 56,
        "column": 1
      }
    }
  ],
  "provenance": {
    "derivedFrom": "capability-spec.json",
    "specContract": {
      "kind": "neutrino.capability-spec",
      "schemaVersion": 1
    }
  }
}
