{
  "kind": "neutrino.participant-view",
  "schemaVersion": "0.2.0",
  "procedure": "dual_bound_offer",
  "dslVersion": "1.0.0",
  "capability": { "capabilityHash": "645962fb563f9a2fe396c4d4261d0f6b0e3733710f4b342f775a62674828bb64", "specVersion": "1.0.0" },
  "participant": { "name": "Merchant", "role": "merchant", "org": "acme", "slotId": "coordinate.dual_bound_offer#Merchant" },
  "visibleOperations": ["OPEN", "NEGOTIATE", "PROPOSE", "COMMIT", "REJECT", "COMPENSATE", "CLOSE"],
  "requiredInputs": [
    { "name": "offer_id", "type": "string", "specPath": "inputs[0]", "source": { "line": 46, "column": 1 } },
    { "name": "merchant_id", "type": "party", "specPath": "inputs[2]", "source": { "line": 48, "column": 1 } },
    { "name": "contribution", "type": "money", "specPath": "inputs[3]", "source": { "line": 49, "column": 1 } },
    { "name": "currency", "type": "currency", "specPath": "inputs[4]", "source": { "line": 50, "column": 1 } }
  ],
  "permittedCounterparties": [
    { "org": "sponsorco", "role": "sponsor" }
  ],
  "binding": { "mode": "to_be_bound", "runtimes": ["evm"], "minAssurance": "A2", "authorizedBinder": "acme" },
  "evidenceObligations": [
    { "leg": "merchant_expected_contribution", "kind": "credit", "ledger": "merchant.expected_contribution", "specPath": "effects[1]", "source": { "line": 62, "column": 1 } }
  ],
  "provenance": { "derivedFrom": "capability-spec.json", "specContract": { "kind": "neutrino.capability-spec", "schemaVersion": 1 } }
}
