{
  "kind": "neutrino.participant-view",
  "schemaVersion": "0.2.0",
  "procedure": "core_promo_campaign",
  "dslVersion": "1.0.0",
  "capability": { "capabilityHash": "7438d20f5e41d9ffd3d3d32ed3d8d180cdcdfb9b022ddfcddb342b2029718239", "specVersion": "1.0.0" },
  "participant": { "name": "Fulfiller", "role": "fulfiller", "org": "fulfillerco", "slotId": "coordinate.core_promo_campaign#Fulfiller" },
  "visibleOperations": ["OPEN", "NEGOTIATE", "PROPOSE", "COMMIT", "REJECT", "COMPENSATE", "CLOSE"],
  "requiredInputs": [
    { "name": "redemption_id", "type": "string", "specPath": "inputs[0]", "source": { "line": 51, "column": 1 } },
    { "name": "fulfiller_id", "type": "party", "specPath": "inputs[3]", "source": { "line": 54, "column": 1 } },
    { "name": "reimbursement", "type": "money", "specPath": "inputs[5]", "source": { "line": 56, "column": 1 } },
    { "name": "currency", "type": "currency", "specPath": "inputs[6]", "source": { "line": 57, "column": 1 } }
  ],
  "permittedCounterparties": [
    { "org": "sponsorco", "role": "sponsor" },
    { "org": "promoterco", "role": "promoter" }
  ],
  "evidenceObligations": [
    { "leg": "fulfiller_reimbursement", "kind": "credit", "ledger": "fulfiller.reimbursement", "specPath": "effects[3]", "source": { "line": 89, "column": 1 } }
  ],
  "provenance": { "derivedFrom": "capability-spec.json", "specContract": { "kind": "neutrino.capability-spec", "schemaVersion": 1 } }
}
